{
  "$schema": "http://json-schema.org/draft-07/schema#",
  "type": "object",
  "properties": {
    "$schema": {
      "type": "string",
      "pattern": "^\\.\\./.+\\.schema\\.json$"
    },
    "name": {
      "type": "string",
      "minLength": 1
    },
    "categories": {
      "type": "array",
      "minItems": 1,
      "items": {
        "type": "object",
        "required": ["slug", "name"],
        "properties": {
          "slug": {
            "type": "string",
            "minLength": 1
          },
          "name": {
            "type": "string",
            "minLength": 1,
            "description": "For UI purposes, this might change in the future."
          },
          "description": {
            "type": "string",
            "minLength": 1,
            "description": "This is a description of the category. It is intended to be used for documentation purposes."
          },
          "subcategories": {
            "type": "array",
            "items": {
              "type": "object",
              "required": ["slug"],
              "properties": {
                "slug": {
                  "type": "string",
                  "minLength": 1
                }
              }
            }
          }
        }
      }
    },
    "protocols": {
      "type": "array",
      "items": {
        "type": "object",
        "properties": {
          "name": {
            "type": "string",
            "minLength": 1
          },
          "logoURI": {
            "type": "string",
            "pattern": "^(https://imagedelivery\\.net/qNj7Q3MCke89zoKzav7eDQ/(tokens/(default|0x[0-9a-f]{40})\\.(png|jpg|jpeg)|validators/0x[0-9a-f]{96}\\.(png|jpg|jpeg)|vaults/0x[0-9a-f]{40}\\.(png|jpg|jpeg)|protocols/[a-z0-9-]+\\.(png|jpg|jpeg))/public)$"
          },
          "url": {
            "type": "string",
            "pattern": "^(https://[^\\s]+)$"
          },
          "description": {
            "type": "string"
          },
          "tags": {
            "type": "array",
            "description": "This is an array of tags. Currently used for UI purposes.",
            "items": {
              "type": "string"
            }
          }
        },
        "required": ["name", "url", "description", "logoURI"]
      }
    },
    "vaults": {
      "type": "array",
      "items": {
        "type": "object",
        "properties": {
          "stakingTokenAddress": {
            "type": "string",
            "pattern": "^0x[a-fA-F0-9]{40}$"
          },
          "vaultAddress": {
            "type": "string",
            "pattern": "^0x[a-fA-F0-9]{40}$"
          },
          "name": {
            "type": "string",
            "minLength": 1
          },
          "action": {
            "type": "string",
            "description": "This is how the vault will be called on BeraHub. It should be a verb (e.g. Stake into...).",
            "minLength": 1
          },
          "protocol": {
            "type": "string",
            "minLength": 1
          },
          "logoURI": {
            "type": "string",
            "pattern": "^(https://imagedelivery\\.net/qNj7Q3MCke89zoKzav7eDQ/(tokens/(default|0x[0-9a-f]{40})\\.(png|jpg|jpeg)|validators/0x[0-9a-f]{96}\\.(png|jpg|jpeg)|vaults/0x[0-9a-f]{40}\\.(png|jpg|jpeg)|protocols/[a-z0-9-]+\\.(png|jpg|jpeg))/public)$"
          },
          "url": {
            "type": "string",
            "pattern": "^(https://[^\\s]+)$"
          },
          "categories": {
            "type": "array",
            "items": {
              "type": "string"
            },
            "$comment": "This is an array of categories. It must have exactly one item. It's an array for future proofing.",
            "minItems": 1,
            "maxItems": 1
          },
          "description": {
            "type": "string"
          }
        },
        "required": [
          "stakingTokenAddress",
          "vaultAddress",
          "name",
          "action",
          "protocol",
          "url",
          "categories"
        ]
      }
    }
  },
  "additionalProperties": false,
  "required": ["name", "protocols", "vaults", "$schema", "categories"]
}
